8|MEHARI_ITProductionEnvironment|||||||
08A|Security of operational procedures |||||||
08A01|Consideration of security in relation with operational personnel (permanent and temporary staff)|||||||
08A01-01|"Is there a security policy, specifically aimed at operations personnel, related to information systems?
This policy should cover the requirements for the protection of information as well as the protection of physical assets and processes and mention the forbidden behaviors"|4|||E1|11.2.1|9.2.1|
08A01-02|Is information systems operations personnel required to sign contract clauses of adherence to that security policy (no matter their status: permanent or temporary staff, students, etc.)?|4|||E2|||
08A01-03|Do these clauses make clear that the obligation to respect that security policy applies to information at large (whichever the support : paper, magnetic, optical, etc.)?|2|2||E2|||
08A01-04|"Do these clauses make clear, if necessary and legally possible, that the obligation to respect the security policy applies without limitation in time?
This applies, in particular, to the clauses concerning confidentiality, they may (and often must) continue after the end of the contract linking (directly or indirectly) the employee or  service provider or partner to the company"|4|2||E3|||
08A01-05|Do these clauses make clear that the personnel has an obligation not to tolerate any action contrary to security from other people?|4|3||E3|||
08A01-06|"Does the signature of these clauses represent a formal commitment?
In order to achieve a formal commitment, the personnel should explicitly state that his/her signature implies having understood and accepted the security policy"|4|3||E2|||
08A01-07|"Are these same clauses obligatory for contractors working on systems operations?
Practically, the contractors should ensure that their personnel sign individually and explicitly under the same conditions than internal staff. "|4|2||E2|||
08A01-08|Is there a mandatory and well adapted training course aimed at systems operation personnel?|2|||E2|||
08A01-09|Are the security policy compliance agreements, signed by personnel, securely kept (at least in a locked cupboard )?  |2|3||R1|||
08A01-10|Are the security policy compliance agreements, signed by external contractors, securely kept (at least in a locked cupboard )?  |2|3||R1|||
08A01-11|Is there a regular audit, at least once a year, of the effective application of the signature procedure by  operational personnel (directly employed by the company or indirectly through a service company) ?  |2|3||C1|||
08A02|Control of the operational tools and utilities|||||||
08A02-01|Have different profiles been defined for the systems operation staff (administration and management of configurations, administration of security equipment, monitoring, audit and investigation)? |4|||E1|12.6.2||
08A02-02|Are all members of systems operation staff attributed with one of these profiles? |4|||E2|12.6.2||
08A02-03|Have all the sensitive system tools and utilities (rights administration, configuration management, backups, copies, hot restarts, etc.) been exhaustively audited and listed for each profile?|4|||E2| 9.4.4; 12.6.2|11.5.4|
08A02-04|Is it possible only for holders of a certain profile to use the corresponding tools and utilities subsequent to proper strong authentication (smart card or token card)?|2|2||E3| 9.4.4; 12.6.2|11.5.4|
08A02-05|Is it forbidden to create or add sensitive tools or utilities without formal authorization?|2|2||E2| 9.4.4; 12.6.2|11.5.4|
08A02-06|Is there a regular automated check to enforce this rule which triggers an alert to an appropriate manager?|2|2||E3| 9.4.4|11.5.4|
08A02-07|Does the segregation of rights of systems operation staff prevent undue modification of sensitive tools or utilities or at least, is there an automatic routine which checks that no modification has been made and which may trigger an alert to a manager if so?|4|2||E3| 9.4.4|11.5.4|
08A02-08|Are the granting of administrative profiles and the implementation of the aforementioned security measures subject to regular audit?|2|2||C1|||
08A03|"Acceptance control of systems introduction or modification
Systems here include operating systems, applications and associated middleware"|||||||
08A03-01|Are the decisions to change or update equipment and systems significantly subject to a control procedure (registration, planning, formal approval, communication to all concerned individuals, etc.)?|4|||E1|12.1.2; 12.6.2|10.1.2|
08A03-02|Are the change decisions based on an analysis of the capacity of the new equipment and systems to ensure the required load and take into account the evolution of foreseeable requests?|2|||E2|12.1.3; 12.6.2|10.3.1|
08A03-03|Do the installations take into account physical protection (protected access, no direct external view on equipments, no multiple physical threats, weather conditions, protection against thunderbolts, protection against dust, etc.)?|2|||E2|11.2.1; 14.2.2|9.2.1; 12.5.1|
08A03-04|Is any new or modified functionality linked to a new system or new version of a system, systematically documented before moving into production?|4|2||E2|12.5.1; 12.6.2; 14.2.2|12.4.1; 12.5.1|
08A03-05|Is such new functionality (or change in functionality), linked to a new system or new version of a system, formally and systematically reviewed in conjunction with the IT security function?|2|||E2|12.5.1; 12.6.2; 14.2.9|12.4.1; 10.3.2|
08A03-06|Does this review include an analysis of the risks that may  result from the changes? |2|2||E2|12.5.1; 12.6.2; 14.2.9|12.4.1; 10.3.2|
08A03-07|Have system operations staff received formal appropriate training in risk analysis?|1|||E3|||
08A03-08|May the operation staff obtain an appropriate support specially competent on risk analysis? |4|||E3|||
08A03-09|Are the security measures, determined to counter the new identified risks, formally reviewed before implementation?|4|2||E3|14.2.9|10.3.2|
08A03-10|Are security parameters and configuration rules (deletion of generic accounts, changing of any default passwords, blocking of unauthorized communications ports, setting of access rights and authentication parameters, etc.) listed in detail and regularly updated?|4|||E3|14.2.9|11.4.4; 10.3.2|
08A03-11|Are the security parameters and configuration rules controlled prior to any start of production of a new version? |4|||E3|14.2.9|11.4.4; 10.3.2|
08A03-12|Has the eventual impact of the systems' changes regarding the continuity plans been considered?|2|||E2|14.2.9|10.3.2|
08A03-13|Are any exemptions from the prerequisite risk analysis and control of security parameters subject to strict procedures, including a signature from senior management?|4|||R1|12.5.1|12.4.1|
08A03-14|Can the start of production of new systems and applications be only carried out by  operations personnel?|2|2||E3|12.5.1|12.4.1; 6.1.4|
08A03-15|Is the start of  production of new versions of systems or applications possible by the use of a defined validation and authorization process? |2|2||E3|12.5.1|12.4.1; 6.1.4|
08A03-16|Are the start of production control procedures regularly audited?|2|3||C1|||
08A04|Control of maintenance operations|||||||
08A04-01|Is a trace of all maintenance operations kept?|1|||E2|11.2.4|9.2.4|
08A04-02|Are all maintenance operations required to terminate with a systematic control of security parameters (as defined at time of start of production)?|4|2||E2|||
08A04-03|Are all maintenance operations required to terminate with a systematic control of the recording parameters for security events and the life span of records?|4|3||E3|||
08A04-04|Are all maintenance operations required to terminate with a systematic control of system administration parameters (required profile, authentication type, removal of standard logins etc.)?|4|3||E3|||
08A04-05|Is a formal exemption, signed by a responsible manager, required if the above mentioned procedures are not observed? |4|||E3|||
08A04-06|Is the effective implementation of these controls regularly audited?|2|3||C1|||
08A05|Confidentiality considerations during maintenance of the production systems|||||||
08A05-01|Is there a procedure describing, in detail, all the operations to execute before contacting maintenance in order to prevent maintenance staff gaining access to operational production data (disconnection of disk arrays and cartridges, deletion of operational data etc.)?|4|||E1|11.2.4; 11.2.7|9.2.4; 9.2.6|
08A05-02|Is there a binding clause in maintenance personnel contracts stipulating that any storage media which contained sensitive data be destroyed before disposal?|4|||E2|11.2.4; 11.2.7|9.2.4; 9.2.6|
08A05-03|Is there a procedure of checking for system integrity after maintenance intervention (absence of spyware, or trojans etc.)?|2|||E2|||
08A05-04|Is a formal exemption, signed by a responsible manager, required if the above mentioned procedures are not observed? |2|3||E3|||
08A05-05|Are the above procedures subject to regular audit?|2|3||C1|||
08A06|Control of remote maintenance|||||||
08A06-01|In the case of remote maintenance, is the remote maintenance desk's access subject to a secure authentication procedure?|2||2|E2||11.4.4|
08A06-02|In the case of remote maintenance, are maintenance staff subject to a secure authentication procedure?|4||2|E2||11.4.4|
08A06-03|Is there a set of procedures covering the granting and revocation of access rights for remote maintenance operatives and the granting of rights in urgent situations?|2|||E3||11.4.4|
08A06-04|Have the procedures and protocols for transmission and retention of secret conventions (in the case of remote maintenance) been approved by the Information Security Officer or a qualified specialist?|4|||E3|||
08A06-05|Does the usage of the remote maintenance line require the prior agreement (for each usage) of system operations personnel (upon request by the manufacturer or editor specifying the nature, date and time of the intervention)?|4|3||E3||11.4.4|
08A06-06|Are data or command exchanges during remote maintenance protected by encryption?|4||2|E3|||
08A06-07|Are data or command exchanges during remote maintenance protected by integrity control (signing)?  |4||2|E3|||
08A06-08|"Is the usage of the remote maintenance line under strict control?
A strict control supposes that each use of the line, the name of the maintenance operative and the actions carried out is registered, and that there be a subsequent audit of the appropriateness of the actions and their conformity with the rules laid down by maintenance managers."|4|3||E2|||
08A06-09|Is the equipment accessible for remote maintenance protected against deactivation or modification of the access conditions for remote maintenance (e.g. by the triggering of an alarm)? |2|2||R1|||
08A06-10|Are control procedures for remote maintenance regularly audited?|2|3||C1|||
08A07|Protection of sensitive printed documents and reports|||||||
08A07-01|Are all sensitive documents and reports printed in secure premises?|4|||E1|||
08A07-02|Are all sensitive documents and reports protected against diversion while being produced?|4|3||E1|||
08A07-03|Are all sensitive documents and reports protected against diversion while waiting for distribution?|4|3||E1|||
08A07-04|Does the distribution system for printouts and reports ensure protection against theft (locked cabinets and carrying cases during transportation)?|4|3||E2|||
08A07-05|Does the distribution system for printouts and reports ensure protection against prying consultation?|4|3||E2|||
08A07-06|Does the distribution system for printouts and reports require the addressee to be authenticated prior to their delivery?|4|3||E3|||
08A07-07|Are printed documents and reports labeled anonymously without showing any particular classification?|4|||E2|||
08A07-08|Are these measures adapted to the maximum security level of the information within (temporary storage in locked strong boxes and hand delivery for very sensitive information)?  |4|||E2|||
08A07-09|Are sensitive printed documents and reports put on the scrap destroyed in a secure way so that they cannot be exploited?|4|3||E2|||
08A07-10|Are the security procedures for distribution of printed material regularly audited?|2|3||C1|||
08A08|Management of Operating Procedures for IT production|||||||
08A08-01|Do the operating procedures result from the study of the overall cases to be covered by said procedure (normal operating cases and incidents)?|4|||E2|12.1.1|10.1.1|
08A08-02|Are the operating procedures documented and kept up to date?|4|||E2|12.1.1|10.1.1|
08A08-03|Are the operating procedures readily available upon request by any accredited individual?|4|||E2|12.1.1|10.1.1|
08A08-04|Is the IT operation Management required to approve changes to procedures ?|4|||E2|12.1.1|10.1.1|
08A08-05|Are these procedures protected from unauthorized alterations?|2|||R1|||
08A08-06|Are the operating procedures audited regularly for authenticity and relevance?|2|||C1|||
08A09|Management of service suppliers and providers relating to IT operations|||||||
08A09-01|Is it regularly ensured that the security services allocated to suppliers or providers are efficiently implemented and maintained by them?|4|||E1|15.1.3|10.2.1|
08A09-02|Is it ensured that the service suppliers or providers  have efficiently prepared the appropriate arrangements to ensure that the services are provided as agreed?|2|||E2|15.1.3|10.2.1|
08A09-03|Is the respect of the security provisions by the suppliers or providers regularly reviewed?|4|||C1|15.1.3; 15.2.1|10.2.2|
08A09-04|Is it ensured that the suppliers and providers report and document any security incident concerning information or systems?|4|||E2|15.2.1|10.2.2|
08A09-05|Is there a regular review of these incidents or malfunctions with the concerned suppliers and providers?|2|||E2|15.2.1|10.2.2|
08A09-06|Are any changes in the contract relationship (obligations, service levels, etc.) analyzed for resulting potential risks?|2|||E3|15.2.2|10.2.3|
08B|Control of hardware and software configurations|||||||
08B01|Conformity control of systems parameters and configurations |||||||
08B01-01|"Is there a document (or a set of documents ) or an operational procedure which describes all security parameters for the systems?
Such a document should be derived from the security policy and describe all the filtering rules decided. It should also mention the reference to the system versions so as to check the status of the updates."|4|2||E1|||
08B01-02|Does this document require that all generic or by default accounts be deleted and their list established? |4|2||E2||11.4.4|
08B01-03|"Are the system versions, fixes and parameters updated regularly in line with latest information?
This should be done in cooperation with expert authorities (specialized audits, subscription to a service center, regular consultation with CERTs, etc.) "|2|3||E2|12.6.1|10.7.4|
08B01-04|Does the resulting document or procedure impose a synchronization feature, based on a reliable time reference?|4|||E3|12.4.4|10.10.6|
08B01-05|Are these reference documents protected, by secure methods, against untimely or illicit alteration (signing)?  |2|3||R1||10.7.4|
08B01-06|Is the integrity of system configurations checked, regularly (at least weekly) if not at each system start-up, against the configuration theoretically expected?|4|2||E3|18.2.3|15.2.2|
08B01-07|Are regular audits carried out of the  compliance to the specifications for security parameters?|2|||R1|18.2.3|15.2.2|
08B01-08|Are regular audits carried out of the exception and escalation procedures in the case of difficulty or installation problems?|2|||R1|18.2.3|15.2.2|
08B01-09|Are the development and test environments separated from the operational environments?|1|||C1|||
08B02|Conformity control of operational software configurations (including packages)|||||||
08B02-01|"Is there a document (or a set of documents ) or an operational procedure which describes the security parameters for all applications?
These parameters should result from the security architecture retained for the applications"|4|2||E1|||
08B02-02|Is this document updated for each change of version?|2|2||E2|||
08B02-03|Does this document require that all generic or by default accounts be deleted and their list established?|4|2||E2|||
08B02-04|"Are the application software versions, fixes and parameters updated regularly in line with latest information?
This should be done in cooperation with expert authorities (specialized audits, subscription to a service center, regular consultation with CERTs, etc.)"|2|3||E2|12.6.1|10.7.4; 12.6.1|
08B02-05|Are these reference documents protected, by secure methods, against untimely or illicit alteration (signing)?  |4|2||R1||10.7.4|
08B02-06|Is the integrity of application configurations regularly checked against the configuration theoretically expected (weekly)?|4|2||E3|18.2.3|10.7.4; 15.2.2|
08B02-07|Are regular audits carried out of possible differences between the security parameters expected and effectively implemented?|2|||R1|18.2.3|15.2.2|
08B02-08|Are regular audits carried out of the exception and escalation procedures in the case of difficulty or installation problems?|2|||R1|18.2.3|15.2.2|
08B03| Conformity control of reference programs (source code and executables) |||||||
08B03-01|Do IT operations manage a reference version for each product installed in production (source code and executables)?  |4|2||E1|12.5.1|12.4.1|Managed by SGBL for core banking.
08B03-02|Is this reference version protected against all possible illicit or untimely modification (signed media kept by a senior manager, electronic signing, etc.)?  |2|||R1|||
08B03-03|Is this protection considered to be inviolable (signing by cryptographic algorithm approved by the Information Security Officer)?  |4|||R2|||
08B03-04|Is the protective seal controlled automatically (otherwise it may be an authoritative signature) at each new installation?|4|||R2|||
08B03-05|Is a check made of the proof of origin and integrity of received maintenance module or a new version, from the editor or the manufacturer (for operating systems)?  |4|||E2|||
08B03-06|Are the signing and signing control tools protected against any unauthorized usage?|4|||R2|||
08B03-07|Does the inhibition of the automatic control of seals trigger an alarm to a manager?|4|||E3|||
08B03-08|Are there regular audits of protection procedures for reference programs? |4|||C1|||
08C| Management of storage media for data and programs|||||||
08C01|Management of storage media|||||||
08C01-01|Are all media removals from the media library controlled by a dedicated person or department responsible for the media handling?|4|||E1|8.3.1|10.7.1|
08C01-02|Are media returns after use by the operations controlled by the same person or department?|4|||E2|8.3.1|10.7.1|
08C01-03|Is the removal of storage media systematically registered (date and time, individual responsible for media, etc.) ?|4|||E2|8.3.1|10.7.1|
08C01-04|Is the disposal of storage media systematically registered (date and time, individual responsible for media, etc.) ?|4|||E2|8.3.1; 8.3.2|10.7.1; 10.7.2|
08C01-05|Is there a procedure to erase data on media before exit or disposal?|1|||E3|8.3.1; 11.2.7|10.7.1; 9.2.6|
08C01-06|Are any missing items systematically subject to a search procedure and a follow-on form included in the overall operational dashboard?|4|||E2|||
08C01-07|Are all movements of storage media into or out of the library strictly controlled with respect to production systems planning? |4|||E3|||
08C01-08|"Are the files related to storage media management under strict control?
A strict control requires that people authorized to access the files be registered and in limited number, that there be a reinforced access control to be able to modify the files and that any modification be logged and audited."|4|2||R1|||
08C01-09|"Are the processes which ensure the management of storage media under strict control?
A strict control requires to control that the software has been effectively, that a regular data integrity test (seal) be performed and that there is an audit, at least once a year, of media management procedures and processes (including handling the anomalies detected in the course of storage media management)."|4|3||C1|||
08C02|Labeling of storage media (live, backups and archives)|||||||
08C02-01|Are magnetic media marked neutrally without any mention of their classification level?|4|||E1|||
08C02-02|"Are the files accompanying the marking system (files which make the link between the label of the media and its contents) under strict control?
A strict control requires that people authorized to access the files be registered and in limited number, that there be a reinforced access control to be able to modify them and that any modification be logged and audited."|4|2||E2|||
08C02-03|"Are the processes which ensure the management of storage media marking under strict control?
A strict control requires that the software used has been validated and undergoes a regular test for integrity (seal) and that there is an audit at least once a year of support media marking procedures and processes (including a management of anomalies detected in the course of support media marking).
This presupposes that there be a document which details all of the requirements of support media marking."|4|3||C1|||
08C03|Physical security of media kept on site|||||||
08C03-01|Is there an automatic and systematic access control to the location used for on site storage of operation media?|4|||E1|||
08C03-02|Does authentication, for access control to the storage rooms of production media, employ user related data that cannot be falsified (smart cards or biometric data for example)?|4||3|E2|||
08C03-03|Does the access control system guarantee that all personnel entering the location are verified (double door limiting the number of people entering to one-at-a-time, process which prohibits the usage of a badge by more than one person etc.)?|4||3|E2|||
08C03-04|In addition to access control for the normal exits, is there a specific control for non authorized exits (windows accessible from outside, emergency exits, potential access via false panels, flooring and ceilings, etc)?|4||3|E3|||
08C03-05|Are the automatic access control systems under 24 hr surveillance enabling to detect in real time the failure or deactivation of the system or the usage of emergency exits?|2|2||R1|||
08C03-06|Is there an audit procedure enabling later to uncover irregularities in the access control procedures (audit of procedures and parameters of access control systems, audit of exceptions and of interventions etc.)?|2|3||C1|||
08C03-07|Is there an operational intrusion detection system for the storage locations, linked to a 24 hr monitoring center?|4|2||R2|||Off-site media is stored in a branch.
08C03-08|Are the on site locations for production storage media placed under 24 hours surveillance (video surveillance of the location itself)?|4|3||R2|||
08C03-09|Is the transfer of production media, between the production and on site storage locations, under strict control (specific moving procedures, secured containers etc.)?  |2|||E2|||
08C03-10|Is the storage location of production storage media protected against accidental risk (fire detection and extinguisher equipment, protection from water damage, etc.)?  |4|||E2|||
08C03-11|Is the storage location for production storage media regulated and supervised for temperature and humidity?|4|||E2|8.3.1|10.7.1|
08C03-12|Are the automatic fire, flood and humidity detection systems, under 24 hour operational control enabling to detect in real time a failure, a deactivation or an alarm?|2|2||R1|||
08C03-13|Is there a procedure or automatic routine which triggers the immediate intervention of specialized personnel in the case of an alarm (of the access control system or the incident detection system)?|2|2||C1|||
08C04|Physical security of storage media (kept in an external site)|||||||
08C04-01|Is use made of a specialized company, which offers contractual guarantees of security, for the storage of archives outside the production site?|4|||E1|||
08C04-02|Does the contract signed with the outside media storage company ensure a high level of security (strong access authentication, control of access points and emergency exits, intrusion detection, video surveillance, protection against natural risk, intervention team, etc.)?  |4|3||E2|||
08C04-03|Does the procedure used for the transfer of sensitive media to the external storage location require a high level of security (like secure containers and transporters accredited by the company)?|4|||E2|8.3.3|10.8.3|
08C04-04|Are there contractual clauses or annex clauses, which stipulate the conditions of restitution of storage media, guaranteeing that the person to whom to the media is returned has the correct authorization even in the case of an emergency procedure? |4|||E3|||
08C04-05|Is there a regular audit of the security measures used by the company ensuring the external storage of archives and backups?|2|3||C2|||
08C04-06|Is there a regular audit of the management procedures related to storage media (transport and return)?  |2|3||C1|||
08C04-07|Is there a regular audit of the contractual clauses specifying relations with the company ensuring the external storage of archives and backups?  |2|3||C1|||
08C05|Verification and turnover of archive storage media |||||||
08C05-01|Are the storage media which retain data for long periods (archives) regularly verified (as a function of the frequency of updates and the classification of the information)?|4|||E2|||
08C05-02|Are the storage media which retain data for long periods (archives) periodically copied to new storage media with the maintenance of an inventory and redundancy of media?|4|||E2|||
