8|MEHARI_ITProductionEnvironment|||||||
08C05-03|Is there a regular verification of the technical compatibility between the storage media and the operational solution used to effect restoration of data?|2|||E3|||
08C05-04|Are regular tests carried out of archived media readability? |4|||E2|||
08C05-05|Do the reread tests contain controls of the authenticity of the information stored?|4|||E3|||
08C05-06|"Are the files used for the management of storage media rotation and sampling under strict control?
A strict control requires that people authorized to access the files be registered and in limited number, that there be a reinforced access control to be able to modify them and that any modification be logged and audited."|4|3||R2|||
08C05-07|Are the procedures concerning the verification of archived storage media regularly audited? |2|3|||||
08C06|Security of storage networks (SAN : Storage Area Network and NAS) |||||||
08C06-01|Are the storage networks physically or logically isolated from other data networks? |4|||E1|||
08C06-02|Are the storage networks protected by a firewall which only allows data and administrative flows related to storage?|4|2||E1|||
08C06-03|Is access to storage bays subject to strong authentication, for authorized elements (servers and administration stations)?|4|3||E2|||
08C06-04|Do the data storage protocols contain a protection against replay?|2|||E3|||
08C06-05|Is data stored using a storage network encrypted before transmission to the network? |4||3|E3|10.1.1|12.3.1|
08C06-06|"Do the solutions, protecting access to data stored on the storage network, offer valid and solid guarantees?   
A cryptographic solution with keys of sufficient length is one of among many parameters to take into consideration (as a function of the algorithm) . 
The recommendation of an official organization can be a confidence factor. At least the solution should have been approved b the CISO."|2|2||E2|||
08C06-07|Are the security mechanisms for access to data protected against infraction or alteration? |4|3||R1|||
08C06-08|Is the switching off or bypass of security mechanisms immediately detected and signaled to a responsible team?|4|2||R1|||
08C06-09|Is this team available 24 hrs a day and capable of intervening immediately?|4|2||R1|||
08C06-10|Is there a procedure detailing the actions to carry out in the case of error or alert?|3|||C1|||
08C07|Physical Security of Transiting Medias |||||||
08C07-01|Are the transfer of medias between sites (internal or external) strictly controlled (specific procedures, follow-up or secured containers, etc.) ?|2|||E1|8.3.3|10.8.3|
08C07-02|Are the medias marked anonymously, without reference to any classification, while in transit? |4|||E2|||
08C07-03|Is any abnormality or media loss immediately reported?|2|||E2|||
08C07-04|Is any abnormality or media loss followed by an investigation?|2|||E2|||
08C07-05|Are the media transfers regularly audited?|2|3||C1|||
08D|Service continuity |||||||
08D01|Organization of hardware maintenance (for operational equipment)|||||||
08D01-01|Is all equipment covered by a maintenance contract?|2|||E1|11.2.4|9.2.4|
08D01-02|Are there specific maintenance contracts for all hardware which require a high availability and for which the replacement must be made within limited delays? |4|||E2|||
08D01-03|Do the contracts stipulate maximum delays before intervention and compatible with the requirements of availability?|4|2||E2|||
08D01-04|Do the contracts detail the required time slots and days of intervention (24h/7d for example) compatible with the requirements of availability?|4|2||E3|||
08D01-05|Do the contracts stipulate the conditions of escalation in case of difficulty?|4|3||R1|||
08D01-06|"Do the contracts detail specific clauses for when the hardware downtime exceeds the specific times stipulated (penalties, hardware replacement, etc.)?
It is desirable that these clauses be general and apply to all cases no matter what the reasons (technical difficulty, staff strikes, etc.)
"|4|3||E3|||
08D01-07|Do the maintenance contracts anticipate the complete replacement of equipment in the case of important damage which might not be taken into consideration by reparative maintenance? |4|||E3|||
08D01-08|Are the maintenance contracts, the choice of subcontractors and associated maintenance procedures subject to regular audit?|2|3||C1|||
08D02|Organization of software maintenance (systems, middleware and applications) |||||||
08D02-01|Are there maintenance contracts for all acquired software products (systems software, middleware and applications)?  |4|||E1|||
08D02-02|Do the suppliers provide a technical software support center which guarantees a quick and competent telephone assistance?|2|||E2|||
08D02-03|Do the software maintenance contracts anticipate the regular release of new versions taking into account all applicable fixes to the product?|4|||E2|||
08D02-04|Are there specific maintenance contracts for software products (systems, middleware and applications) which require corrective delays that standard maintenance cannot cover?|4|||E2|||
08D02-05|Do these contracts detail specific maximum intervention delays, compatible with the availability requirements?|4|2||E2|||
08D02-06|Do the contracts detail the required time slots and days of intervention (24h/7d for example) compatible with the requirements of availability?|4|2||E3|||
08D02-07|Do the contracts stipulate the conditions of escalation in case of difficulty?|4|3||R1|||
08D02-08|"Do the contracts specify specific clauses when system downtime exceeds specific durations stipulated (penalties, replacement of hardware, etc.)?
It is desirable that these clauses be general and apply to all cases no matter what the reasons (technical difficulty, staff strikes, etc.)"|4|3||E3|||
08D02-09|Are the maintenance contracts, the choice of subcontractors and associated maintenance procedures subject to regular audit?|2|3||C1|||
08D03|Application recovery procedures and plans following incidents during operation|||||||
08D03-01|"Has a list been established, for all applications, of incidents which could occur during production and, for each of these, the seriousness of possible consequences?
Critical consequences may relate to data consistency and continuity of service"|4|||E1|||
08D03-02|For each incident during operation have the corresponding diagnostic means been identified?|4|||E2|||
08D03-03|For each incident during operation, has a solution been established as well as the operations to carry out by system operation personnel?|4|||E2|||
08D03-04|For each possible incident during operation, have an acceptable resolution delay and an escalation procedure been determined in the case of failure or lateness of the anticipated corrective actions?|2|||E3|||
08D03-05|Are the diagnostic means, needed by system operation personnel, protected against any possible inhibition or unauthorized modification? |2|3||R1|||
08D03-06|Are the corrective means, needed by system operation personnel, to solve a critical operation incident protected against any possible inhibition or unauthorized modification? |2|3||R2|||
08D03-07|Are there regular tests concerning the efficiency of the procedures and facilities which survey and diagnose the applications' operation?|2|||C1|||
08D03-08|Are there regular checks concerning the update of the corresponding documentation?|2|||C2|||
08D03-09|Are regular tests made of the effective capacity to restore data and  restart the application after an incident during operation? |2|3||C1|||
08D03-10|For encrypted data retrieval, does the Key Management provide the recovery for lost or altered keys?|2|||E3|10.1.2|12.3.2|
08D04|Backup of software configurations (system, applications and configuration parameters)|||||||
08D04-01|Has a backup plan been established which covers all programs and defines all objects to save and the frequency of backups?|4|||E1|12.3.1|10.5.1|
08D04-02|Does the plan also cover system and middleware configuration parameters to save?|4|3||E2|12.3.1|10.5.1|
08D04-03|Does the plan also cover application parameters to save?|4|3||E2|12.3.1|10.5.1|
08D04-04|Is the plan implemented by automatic production routines?|2|3||E2|12.3.1|10.5.1|
08D04-05|"Are there regular tests that the backup copies of programs (source code and/or executables) enable the effective restoration of the production environment at any time?
These tests should consider all the backups (including documentation and parameters files) of legitimate elements."|4|2||E2|12.3.1; 17.1.2; 17.1.3|10.5.1; 14.1.5|
08D04-06|"Are the production routines which ensure backups protected, against illicit or undue modification, by secure mechanisms? 
Such mechanisms might be electronic seal or any equivalent modification detection system."|4|3||R1|12.3.1|10.5.1|
08D04-07|Are regular tests made of the readability of backups?|2|3||R2|12.3.1|10.5.1|
08D04-08|Are all software backup plans and procedures subject to regular audit?|2|3||C1|||
08D05|Backup of application data |||||||
08D05-01|Has a preliminary study been made, in conjunction with the users, to identify the scenarios which backups must be able to cover?|1|||E1|12.3.1|10.5.1|
08D05-02|"Has an analysis been carried out with the users in order to define for each file the maximum acceptable time between two backups? 
These studies are to be based on the capacity to rebuild lost information and permit to define the required backup cycle "|2|||E1|12.3.1|10.5.1|
08D05-03|Have studies been made of the necessary synchronization between bound backups for all platforms in order to ensure the proper functioning of the resumed applications and the coherence of the data necessary for this resumption?|2|||E1|12.3.1|10.5.1|
08D05-04|From above studies, have the various procedures been recorded in a backup plan comprising, for each class of files, the frequency, the details of constitution and the necessary synchronizations?|4|2||E2|12.3.1|10.5.1|
08D05-05|Does the backup plan integrate a control plan pointing out the various control points (size of files, duration, reread, etc.) and their frequency?|2|||E3|12.3.1|10.5.1|
08D05-06|Does the control plan mention the actions to effect in the case of incident or anomaly?|2|||E3|12.3.1|10.5.1|
08D05-07|"Is the backup plan updated each time the operation's environment is changed?
Updates should occur in particular at the time of addition or modification of applications"|2|||E2|12.3.1|10.5.1|
08D05-08|Has the backup plan been translated to automatic operational routines? |2|||E2|12.3.1|10.5.1|
08D05-09|Are regular controls carried out to ensure that a restart or start up is possible from the backups made (i.e. a complete test which verifies all functionality and the absence of synchronization or coherence problems)?  |4|2||E2|12.3.1; 17.1.2; 17.1.3|10.5.1; 14.1.5|
08D05-10|"Are production routines which effect backups under strict control with regard to illicit or undue modification?
A strict control requires a reinforced access control to modify these routines, a logging and an audit of all modification and/or an integrity control by electronic signing of the automatic operational routines."|4|3||R1|12.3.1|10.5.1|
08D05-11|Do the data saving and retention procedures offer guarantees of compliance to regulations and commitments from the organization regarding confidentiality and integrity?|1|||E3|12.3.1|10.5.1|
08D05-12|Are there regular tests to reread backups of application data? |2|3||E2|12.3.1|10.5.1|
08D05-13|Are several generations of files systematically kept in order to guard against any losses or illegibility by organizing, for example, the rotation of backup storage media? |4|||E3|12.3.1|10.5.1|
08D05-14|Are all data backup plans and procedures regularly audited? |2|3||C1|||
08D06|Disaster Recovery Planning for IT operations|||||||
08D06-01|Have all the scenarios which may impact the IT infrastructure and services been considered and, for each scenario, the consequences in terms of service unavailability for users?|4|||E1|17.1.2|14.1.3|
08D06-02|"For each scenario, and in agreement with the users, have a list and schedule of IT service resume been defined?
Loss of information, means to reconstruct them and temporary operational procedures must be considered."|4|2||E2|17.1.2|14.1.3|
08D06-03|Has an activity recovery solution been defined and implemented to resolve each scenario identified above, in accordance with user requirements?|4||2|E1|17.1.2|14.1.3|
08D06-04|"Are the technical, organizational and human resources sufficient to address the organization's requirements for IT continuity?
This means being able to correct personnel deficiencies"|4|||E2|17.1.2|14.1.3|
08D06-05|"Are the technical, organizational and human resources educated to address the organization's requirements for IT continuity?
This implies to train appropriately all concerned staff."|4|||E2|17.1.2|14.1.3|
08D06-06|Are all these solutions described in detail in Disaster Recovery Plans including the conditions for triggering the plan, the actions to execute, the priorities, the actors to mobilize and their contact details? |4|||E1|17.1.2|14.1.3|
08D06-07|Are these plans tested at least once a year?|4|2||E2|17.1.2; 17.1.3|14.1.5|
08D06-08|"Are above tests able to guarantee that the staff capacity and the recovery systems can cope, under full operational load, the minimum IT services required by users?
The tests required to obtain this guarantee are preferably full scale tests of each variant of scenario, involving all users. The results of the tests have to be registered and analyzed in order to improve the capability of the organization to answer to the situations considered. "|4|3||E2|17.1.2; 17.1.3|14.1.5|
08D06-09|If the recovery solutions include delivery of hardware components (which cannot be triggered during tests), is there a contractual commitment by the manufacturer or any relevant third party (leaser, broker, distributor) to deliver the replacement hardware within fixed and anticipated time limits as stated in the recovery plan?|4|2||E2|||
08D06-10|Has the unavailability or failure of the recovery facility been considered and has a replacement solution been defined and validated (second level recovery)?|2|3||E2|||
08D06-11|Has this (second level  recovery) solution been validated?|2|3||E3|||
08D06-12|Is the recovery solution usable for an unlimited duration and, if not, has a follow on replacement solution been established?|2|3||E3|||
08D06-13|Are the existence, the pertinence and the updates of the IT services Recovery Plans regularly controlled?|2|3||C1|||
08D06-14|Is the updating of the above procedures within the recovery plan subject to regular audit?|2|3||C1|||
08D07|Anti virus protection for production servers |||||||
08D07-01|Have the measures to be taken by the IT staff been defined so as to prevent, detect and correct any attacks by malicious code (virus, spyware, other)?|2|3||E2|12.2.1|10.4.1|
08D07-02|Are production servers (including office and mail servers) protected by anti virus or malicious code software? |4|||E1|12.2.1|10.4.1|
08D07-03|Are several antivirus software (from different editors) simultaneously operating for the protection of the operation servers?|4|||E2|||
08D07-04|Are antivirus software products regularly and automatically updated (daily)?|4|2||E2|||
08D07-05|Is a subscription held with an emergency response center able to warn and anticipate large scale virus attacks for which the installed antivirus software is not yet up to date?|4|3||E3|||
08D07-06|Is there an emergency committee which can be implemented quickly in the case of alert or detection of viral infection? |4|3||E2|||
08D07-07|Is the activation and the update of antivirus software on servers subject to regular audit?|2|3||C1|||
08D08|Management of critical systems (regarding maintenance continuity) |||||||
08D08-01|"Have the consequences of the disappearance of a supplier been analyzed (in the case of failure, a bug or change requirement) and has a list of critical systems been established? 
This is valid for hardware, software or service providers"|2|||E2|||
08D08-02|For all critical systems, has a corrective solution been analyzed to cope with the failure or disappearance of a supplier (consignment of maintenance documentation or source code with a trusted third party, hardware replacement by standard market solutions etc.)?|2|||E2|||
08D08-03|Is there a guarantee that the corrective solutions could be made operational within time delays compatible with the continuity of the business and accepted by the users?|2|2||E2|||
08D08-04|Have variants to the primary solution been considered in case it might encounter unforeseen difficulties?|2|3||E3|||
08D08-05|Is there a regular review of critical systems and corrective solutions envisaged?|2|3||C1|||
08D09|Off site emergency (recourse) backups |||||||
08D09-01|Are all software backups and configuration files, which enable the restoration of the production environment, also saved at a location off premises (recourse backup)?|4|3||E1|||
08D09-02|Are all data saved for backup also saved at a location off premises (recourse backup)?|4|2||E1|||
08D09-03|Are regular tests carried out that these emergency backups can be read?|2|3||E2|||
08D10|Maintaining user accounts|||||||
08D10-01|Has it been defined with the users the maximum acceptable delay for reinstating their rights  following the  accidental or deliberate blocking of their accounts (application, system, or network?|4|||E1|||
08D10-02|Is the procedure to follow if an account is blocked defined? |4|||E2|||
08D10-03|Is this procedure known to users? |2|||E2|||
08D10-04|Does this procedure respect the maximum acceptable delay in the case of isolated blockage of several accounts (denial of service attack)? |2|2||E2|||
08D10-05|Is the possibility of simultaneous blockage of many accounts allowed for? |4|3||E3|||
08D10-06|Has the procedure to follow if many accounts are simultaneously blocked been defined with users? |4|3||E3|||
08D10-07|Are user account preservation procedures audited regularly?|2|2||C1|||
08E|Management and handling of incidents |||||||
08E01|Online detection and treatment of IT related abnormal events and incidents|||||||
08E01-01|Has a detailed analysis been carried out of the events or succession of events which may reveal abnormal behaviors or illicit actions and, as a consequence, have specific monitoring indicators or control points been identified?|4|||E2|16.1.4||
08E01-02|Is the system equipped with an automatic real time monitoring system in the case of an accumulation of abnormal events (for example unsuccessful connection attempts on non-open ports)?|4|||E3|16.1.4||
08E01-03|Is there one application able to analyze the individual anomaly diagnostic data and trigger an alert to operational personnel?|4|||E3|16.1.4||
08E01-04|Is there, within operational personnel, a team or individual available 24 hrs a day and capable of reacting in the case of an alert after this application has detected an anomaly?|4|2||E3|16.1.4||
08E01-05|Has the expected response time from the surveillance team been defined for each case of alert and are its availability and staffing level sufficient to meet these expectations?|4|||E3|16.1.4||
08E01-06|Are the alarm definition parameters strictly protected (restricted access rights and strong authentication) against illicit modification?|4|3||R1|||
08E01-07|Does the shutdown of the alarm system trigger an alert with the surveillance team?|4|3||R1|||
08E01-08|Are all the elements which enabled the detection of an anomaly or incident archived (on disk, cassette or DON etc.)?|2|||E2|||
08E01-09|Are the procedures of detection of the anomalies and the availability of the surveillance team subject to regular audit?|2|3||C1|||
08E02|Offline management of traces, logs and event journals|||||||
08E02-01|Has a detailed analysis been carried out of the events or succession of events which may have an impact on security (refused connections,  reconfigurations, changes in performance, access to sensitive data or tools etc.)?|2|||E1|||
08E02-02|Are these events recorded as well as the parameters useful for their subsequent analysis?|4|||E1|||
08E02-03|Is there an application able to analyze these records as well as performance measurements and to infer statistics, a dashboard, anomaly diagnostics, etc. for examination by a competent team?|4|2|3|E2|||
08E02-04|Is the structure in charge of the analysis of these summaries (or incident logs and security related events) obliged to do so at regular intervals and does it have sufficient availability?|4|||E2|||
08E02-05|Has the expected reaction from the surveillance team been defined for each case of alert and is its availability level sufficient to meet these expectations?|4|||E3|||
08E02-06|Are the parameters defining the elements to record and the summaries effected on these elements strictly protected against unauthorized change (limited rights and strong authentication)?|4|||R1|||
08E02-07|Is any inhibition of the recording and processing system immediately signaled to the surveillance team?|4|||R1|||
08E02-08|Are the records and summary analyses kept for a long period?|2|||E2|||
08E02-09|Are the procedures for recording, processing and analysis of the records and summaries as well as the availability of the analysis and corrective team subject to regular audit?|2|||C1|||
08E03|Management of system and application incidents|||||||
08E03-01|Is there a hot-line charged with taking and recording calls and to log and escalate all incidents?|2|||E1|16.1.5||
08E03-02|Is this hot-line team available 24 hours a day?|2|||E2|16.1.5||
08E03-03|Is there a system to support incident management?|1|||E2|16.1.5||
08E03-04|Does this system centralize incidents detected both by operational personnel and by users?|4|2||E2|16.1.5||
08E03-05|Does the system cater for a systematic follow-up of necessary actions?|4|||E3|16.1.5||
08E03-06|Does this system incorporate a categorization of incidents with statistics generation and dashboards destined for use by the Information Security Officer?|4|||E3|16.1.5||
08E03-07|"Is the incident management system strictly controlled with regard to unauthorized or inadvertent modification?
A strict control requires a reinforced protection in order to modify records and an audit trail of all modifications of records or protection by electronic seal on all records modification."|4|3||R1|||
08E03-08|Is each major incident on systems or applications subject to a specific follow-up (nature and description, priority, technical solution, progress analysis, expected resolution lead time etc.)?|4|||E2|16.1.1||
08F| Control of administrative rights|||||||
08F01|Control of administrative access rights granted on systems|||||||
08F01-01|Have profiles been defined, within IT operations staff, corresponding to each type of activity (system administration, administration of security equipment, system monitoring, management of data storage and backup functions etc.)?|1|||E1|6.1.2; 9.2.3; 9.2.5|10.1.3; 11.2.2|
08F01-02|For each profile have the necessary rights and privileges been defined? |4|2||E1|6.1.2|10.1.3|
08F01-03|Does the process of attributing special rights require the formal authorization of management (or the manager responsible for external service providers) at a sufficiently high level?|4|2||E2|6.1.2|10.1.3|
08F01-04|Is the process of attributing special rights allocated only in relation to the profile of the holder?|4|2||E2|6.1.2|10.1.3|
08F01-05|"Is the process of granting (modification or revocation) of special rights to an individual strictly controlled?
A strict control requires a formal recognition of the signature (electronic or not) of the requestor, that there be a tight control of access in order to attribute or modify such rights and that any modification of special rights be logged and audited."|4|2|3|R1|9.2.3; 9.2.5|11.2.2|
08F01-06|Is there a systematic process of removal of special rights at the time of departure or role change of IT operations staff?|2|||E2|9.2.5|11.2.4|
08F01-07|Is there a regular audit, at least once a year, of all special rights attributed ?|1|2||C1|9.2.5|11.2.4|
08F02|Authentication of administrators and operational personnel  |||||||
08F02-01|"Is the authentication protocol used for administrators or holders of special rights considered to be secure?
An authentication protocol is considered secure if it is not susceptible to being broken by a listening device on the network or rendered inoperable by specialists tools (in particular password crack tools ). Such security usually uses cryptographic methods."|4||4|E2|||
08F02-02|"Are the rules, for instance in the case of passwords, considered to be very strict?
Strict rules impose the use of tested non-trivial passwords, using a mixture of different types of characters and of a reasonable length (ten characters). It is desirable that these rules have been approved by the Information Security Officer"|2|||E2|||
08F02-03|Is there a consistent control of the administrator's rights, of its context, and of the suitability of this context with the requested access, as per formal rules of access control?|4|||E2|||
08F02-04|"Are authentication parameters under strict control?
A strict control requires that the list of people able to change authentication rules, the credentials themselves and the surveillance rules of connection attempts be strictly limited, that there be a reinforced access control in order to be able to modify these rights and that any modification of these rights be logged and audited and that there be a general audit at least once a year of all authentication parameters."|4|2||R1|||
