8|MEHARI_ITProductionEnvironment|||||||
08F02-05|"Are the processes that guarantee authentication under strict control? 
A strict control requires that the software used has been validated and undergoes a regular test for integrity (seal) and that there is an audit at least once a year of the authentication procedures and processes."|4|3||R1|||
08F02-06|Is there a regular audit of the privileged profiles effectively granted?|4|3||C1|9.2.5|11.2.4|
08F02-07|Is there a regular audit of the procedures of granting privileged rights and the security parameters attached to protecting profiles and rights?  |4|3||C1|||
08F03|Surveillance of system administrators' actions|||||||
08F03-01|Has a detailed analysis been carried out of the events and operations carried out with administrative rights which may potentially have an impact on system security (configuration of security systems, access to sensitive information, usage of sensitive tools, download or modification of administrative tools etc.)?|2|||E2|12.4.3|10.10.4; 10.6.1|
08F03-02|Are these events recorded as well as all parameters which may be useful for their subsequent analysis? |4|||E2|12.4.3|10.10.4; 10.6.1|
08F03-03|Is there a system able to detect any modification or deletion of a past record and to immediately trigger an alarm to a manager? |4|2||E3|12.4.3|10.10.4|
08F03-04|Is there a summary of these records enabling management to detect abnormal behavior?|4||3|E3|12.4.3|10.10.4|
08F03-05|Is there a system enabling the detection of any modification of recording parameters and to immediately trigger an alarm to a manager? |4|2||E3|12.4.3|10.10.4|
08F03-06|Does any inhibition of the recording and processing of the logged events system trigger an alarm to a manager? |4|||E3|12.4.3|10.10.4|
08F03-07|Are all records or summary analyses protected against any falsification or destruction?|2|||E2|12.4.3|10.10.4|
08F03-08|Are all records or summary analyses kept for a long period?|2|||E2||10.10.4|
08F03-09|Are the procedures, which record and process privileged operations, regularly audited? |2|||C1||10.10.4|
08G|Audit and control Procedures relative to Information Systems|||||||
08G01|Operation of Audit Control|||||||
08G01-01|Have requirements and enforced procedures for the audit of IT systems been enacted by Management?|4|||E2|12.7.1|15.3.1|
08G01-02|"Are the rules related to Information System audits, relevant procedures and associated responsibilities defined and documented?
The restrictions concern the type of access to data and applications, the authorized controls and processing, the deletion of sensitive data obtained, the flagging of certain operations, ... and the empowerment of the individuals conducting the audits. "|3|||E2|12.7.1|15.3.1|
08G01-03|Are the auditors independent of the concerned activities?|2|||E2|12.7.1|15.3.1|
08G01-04|Are audit operations conducted for critical data recorded?|2|||E3|12.7.1|15.3.1|
08G02|Protection of Tools and Audit Results|||||||
08G02-01|"Are the audit tools protected to avoid any unauthorized or malevolent use?
This applies particularly to intrusion testing and vulnerability assessments."|3|||E2||15.3.2|
08G02-02|Are the audit results protected against any modification or disclosure?|3|||E2||15.3.2|
08G02-03|"Are the auditors' activities delimited?
Such a delimitation is especially recommended regarding external auditors"|2|||E2||15.3.2|
08H|Management of IT related archives|||||||
08H01|Organization of the management for IT archives|||||||
08H01-01|Is there an organization in charge of archiving IT files that require to be kept over a long period? |4|||E2|||
08H01-02|Is there a procedure forcing users to use this archiving service for all the files that require to be kept over a long period? |4|||E2|||
08H01-03|Has a list of conditions been established and updated by each owner of data requiring to be archived concerning the archiving rules?|4|1||E1|||
08H01-04|"Are the requirements for external (legal and regulatory) and internal archiving defined and tackled by the entity owning the data and accepted by the top management at the highest level? 
The consequences (legal, financial, image) of non compliance (partial or total) of the archiving requirements must be endorsed by the board of managers."|4|||E1|16.1.7; 18.1.3|13.2.3; 15.1.3|
08H01-05|"Are service agreements negotiated with the IT department, considered as agents only for the data?
Each agreement must state the requirements: content of the archives, retention duration, durability, capacity to trace, imputability, non disclosure, procedures and delay for disposal, administrative constraints, etc.
A clear separation must be stated between the content of the archives, under responsibility of the owner of data, and the container (media, disks, tapes, cartridges) under the responsibility of the IT department."|4|1||E2|18.1.3|15.1.3|
08H01-06|Are the resources necessary for archiving the data known and financed over the longer term?|2|1||E2|18.1.3|15.1.3|
08H01-07|Are there regular readability tests of the archives?|4|||C1|||
08H01-08|"Are the possible modifications resulting from technological or regulatory evolutions, that may modify the content or the containers of the archives,  taken into account, documented and accepted by the management? 
These evolutions cannot be avoided on the long term and all the external regulations must be respected in order to guarantee the conformity of the data to the original ones."|4|2||E2|||
08H01-09|Is the existence of the hardware and software tools for the processing of the archives regularly controlled?|2|||C1|||
08H01-10|"Is there a regular control of the procedures stated for the archiving and any deviation related to the data owners? 
The controls must also look for eliminating the possibilities of fraud involving the persons in charge of the operations as well as those who may have an access to the contents or the containers. "|4|2||C1|||
08H01-11|Are all the procedures concerning the archiving policy audited regularly? |4|3|||||
08H02|IT Archives access management|||||||
08H02-01|Have the requirements and procedures to be followed to access the archives been specified by management? |2|||E2||15.3.1|
08H02-02|Does each archive or set of archives have a designated owner?|4|||E2|||
08H02-03|Are requests for extracts from the archives accepted only from the designated owner? |4|2||E2|||
08H02-04|Is a request from the owner subject to authentication? |4|2||E2|||
08H02-05|Is this authentication check considered to be strong?|4|3||E3|||
08H02-06|Given that users do not have access to the archives, does the archival department always keep the original version? |4|3||E3|||
08H02-07|Is access to the archives by archival personnel subject to strong authentication? |4|3||E3|||
08H02-08|Is each access recorded in a secure manner?|4|3||E3|||
08H02-09|Is transfer of an archive or of a copy to the requester carried out in a secure manner? |4|3||E3|||
08H02-10|Are the conditions of access to the archives and the associated security systems audited regularly|3|2||C1|||
08H03|Management of IT archive safety|||||||
08H03-01|Are the archive storage locations equipped with suitable fire detection and extinction systems and water leakage detection and evacuation? |3|2||E2|||
08H03-02|Are the archive storage locations equipped with an access control system backed up with intruder detectors?|3|||E2|||
08H03-03|"Are the archive storage locations under video surveillance when not occupied?
"|2|3||E2|||
08H03-04|"Are the archive storage locations under permanent video surveillance?
"|2|3||E2|||
08H03-05|Are archive media labeled without reference to the content?|3|||E2|||
08H03-06| Are the index tables used to associate content to an archive media number  inaccessible to the staff managing the archive media?|3|3||E2|||
08H03-07|Are these index tables backed up?|3|3||E2|||
08H03-08|Does stopping or interrupting the safety systems (fire, water, access control, intrusion detection) cause an alarm at a monitoring center for rapid intervention?|3|3||R1|||
08H03-09|Are the storage conditions for archives and the associated safety systems audited regularly?|3|2||C1|||
